ticket_id_A;ticket_id_B;similarity;subject_A;subject_B
SUP-32656;SUP-32575;0.8170;Digital Signatur/PEnneo kører ikke;Digital signatur kører ikke
SUP-32503;SUP-27374;0.7992;Ønske ferie;Ønsket ferie / Ønske ferie
SUP-32465;SUP-30376;0.7873;Kan ikke indsætte basisrul for mine nattevagter;Fejl i udrulning
SUP-32431;SUP-30377;0.7857;TOIL beregnes ikke på planlagt overarbejde;JDE TOIL record on terminated employees
SUP-32173;SUP-27246;0.8225;Manglende referencenr. på elektroniske dokumenter;ref nummer mangler digital signatur
SUP-33825;SUP-32353;0.8073;Ferie opdateres ikke når det slettes;Slettet feriefri fjernes ikke fra medarbejderen og kan gå i negativ
SUP-33227;SUP-25847;0.8108;Ferieoptjening i forhold til anden norm afregner ikke korrekt;Ferieafholdelse/optjening
SUP-32220;SUP-32688;0.7851;Bruger kan ikke synkronisere kalender;spørgsmål
SUP-33760;SUP-33754;0.8132;OK 59;OK 48-1 - 1. maj
SUP-33721;SUP-31722;0.8371;Medarbejder kan ikke ændre fravær;Annullering af ferie
SUP-32665;SUP-32742;0.8215;App og kalender og Iphone15;Kalender Synkronisering 
SUP-33773;SUP-31478;0.8256;JDE can't delete absence from base plan;JDE can't delete absence from base plan
SUP-33790;SUP-31598;0.8000;får ingen sms ;manglende SMS afsendelse
SUP-33381;SUP-33247;0.8028;Bytte vagter;Vagtbytte
SUP-33350;SUP-30430;0.7921;Kan ikke lønlukke evt som SUP-32873;Fejl ved lønlås
SUP-32977;SUP-33040;0.7891;Fraværs årsag på medarbejder app;Misvisende arbejdstider/dage  
SUP-33599;SUP-31351;0.7986;Fejl i afspadserings saldo;Fejl i medarbejder afspadsering. 
SUP-33782;SUP-26876;0.7946;Fraværstype ikke mulig at vælge.;Valg af fraværstyper på web/mobil app
SUP-33315;SUP-31170;0.7930;TimePlan er nede;Timeplan utilgængelig
SUP-33759;SUP-30136;0.8167;error 503 when trying to connect API. ;Failed HTTP requests to TimePlan API (503)
SUP-33734;SUP-28012;0.8280;Timeplan online ;Can't reach the page
SUP-33333;SUP-30062;0.7809;Afspadseringstimer beregnes ikke ifm. ændring af overenskomst.;Afspadseringskonto.
SUP-33746;SUP-32632;0.8393;elektroniska dokument får ej ref.nr;Mangler referencenumre i TimePlan
SUP-33732;SUP-30046;0.8389;Timeplan utilgængelig;Timeplan utilgængelig
SUP-33731;SUP-24908;0.8025;Timeplan er nede;adgang til Timeplan på mobil
SUP-33725;SUP-29400;0.8040;E-signature - får ikke kontrakter til underskrift;dokumenter til underskrift får ikke reference nr.
SUP-32683;SUP-30159;0.7990;Maglende udbetaling af kørselsgodgørelse;Kørsel som ikke er kommet med over til løn. 
SUP-33707;SUP-29913;0.8037;tilldelade feriedagar i DK;ff dage tilskrivning
SUP-33198;SUP-32743;0.8066;Kontrakter blir ikke sendt;Elektroniske kontrakter mangler referanse
SUP-33075;SUP-33069;0.7934;Starta om elektroniska dokument;Starta om elektroniska dokument
SUP-32896;SUP-27097;0.8078;Username or password incorrect;kan ikke logge på timeplan
SUP-32207;SUP-25471;0.7812;Jeg kan ikke udlåne en medarbejder.;Bruger kan ikke udlåne
SUP-32092;SUP-31311;0.8237;Kan ikke godkende dagen;Tidsregistrering: arbejdstid kan hverken ophæves eller godkendes
SUP-31917;SUP-31670;0.8002;En bruger der ikke kan logge ind. Måske låst?;Bruger der ikke kan logge ind
SUP-31688;SUP-32053;0.8196;Plan status isn't auto approved anymore;"Same issue as in SUP-31245 ? Autorun for ""approve Work plan"" not working since hosting move"
SUP-31670;SUP-27774;0.8157;Bruger der ikke kan logge ind;Kan ikke logge ond
SUP-33055;SUP-30371;0.8090;Omsorgsdage;børne omsorgstimer konto 
SUP-31295;SUP-32153;0.8132;Script i lønfil ;Hjælp til opsætning af lønart i exportfil
SUP-33657;SUP-32477;0.7823;Logning af fraværssletninger;Log- historik
SUP-31198;SUP-32159;0.7837;Medarbetare är röd i kalendern;Medarbetare i fel butik
SUP-30836;SUP-27201;0.7814;Planering - Menu ;Verktygslister försvunnit efter senaste uppdateringen
SUP-30383;SUP-29630;0.8351;Harald Nyborg;Harald Nyborg
SUP-30370;SUP-31727;0.8051;kontrakter penneo;Kontrakter udsendes ikke 
SUP-33493;SUP-30902;0.8281;Nedsat tid;Ændring af arbejdstimer - Uden flexberegning
SUP-32980;SUP-28116;0.7866;Basisplan;Hvordan sletter man basisplaner? (907)
SUP-32790;SUP-26678;0.8070;Særlige feriedage og overførelse af ferie ;Overførsel af ferie/feriefri for restferie gl. ferieår til nyt ferieår - hvordan?
SUP-31082;SUP-30575;0.8171;Vi smides af programmet....;Programmet lukker.
SUP-33650;SUP-31400;0.7971;Timeplan afspadsering, Fangelbogård;Fejl i medarbejder afspadsering. 
SUP-33673;SUP-32234;0.8357;Plan status;appen
SUP-33663;SUP-33431;0.8196;Timeplan app på telefon ingen adgang?;Vores Timeplan webversion og app virker ikke.
SUP-29915;SUP-27939;0.8108;TimePlan Native App, ;Efter opdatering til Cloud problemer med Android telefoner og TimePlan appen
SUP-32247;SUP-31984;0.8033;Indsat feriefri uden jeg kan se det ?;Feriefri
SUP-33619;SUP-32682;0.8014;Kontrakt skickas inte till Penneo;Problem igen med att skicka avtal till Penneo
SUP-33666;SUP-29200;0.8343;Server issues. ;adgang
SUP-33651;SUP-30457;0.8214;Digital signatur;Digital signatur
SUP-33623;SUP-28191;0.8170;Synliggjort vagtplan, men medarbejderne kan ikke se det i appen;kan ej se schema i webapp
SUP-28712;SUP-26991;0.7975;Kan inte ansluta till nya SFTP:en Norge;Felleskjøpet - whitelist SFTP-server
SUP-13050;SUP-28639;0.7931;Autogodkender ikke på trods af stempling ligger indenfor tolerence;Hvorfor system godkender den kun på nogle?
SUP-33589;SUP-29369;0.8149;Går ej att logga in;https://online.timeplan-software.com/gda/ 
SUP-32898;SUP-31235;0.8388;dobbelt træk ferie/feriefri dage;Trækker dobbelt på feriedage
SUP-33560;SUP-32735;0.8334;Mail ved ønsket fravær;Manglende besked  ved ønsket fravær
SUP-33510;SUP-33474;0.8207;Lønoplysninger i app'en;Lønoplysninger i App
SUP-33568;SUP-31701;0.8287;Helligdags farve;Helligdage får ikke farve
SUP-29779;SUP-31218;0.8253;Negativ saldo i ferieoversigten;Feriefri saldoer i minus
SUP-17354;SUP-30741;0.7931;Sommertid/vintertid;Vintertid og arbejde henover skiftet
SUP-33469;SUP-32690;0.8149;Feriefritimer;Rettelse af normtid i fravær
SUP-32846;SUP-19903;0.7945;Ændring af feriefri års periode;Feriefri regel
SUP-33186;SUP-31645;0.8277;Tilgængelighed ikke rettet;Projekt er fjernet permanent fra medarbejder
SUP-32892;SUP-31506;0.8397;Ferie saldo i minus;Ferie med løn i minus
SUP-33206;SUP-30996;0.8059;Timeplan app virker ikke efter opdatering;Timeplan app nede
SUP-33224;SUP-31929;0.8022;Saldo på ferie der udløber er ikke korrekt efter opdatering;Forkert visning på feriefri
SUP-27144;SUP-30405;0.8342;Fleksibel deltid: Spørgsmål til varslingsregler;Fleksibel deltidsbeskæftigelse
SUP-33406;SUP-28535;0.7827;SFTP server;Kan ikke eksportere - haster pga løn
SUP-33509;SUP-31297;0.7958;Appen;Fravær kan ikke ses på mobilversion 
SUP-33474;SUP-32194;0.8052;Lønoplysninger i App;Lønoplysninger
SUP-33389;SUP-33418;0.8292;JES/JPT PROD + new servers upgrade;JRO PROD + New servers upgrade
SUP-33418;SUP-33248;0.8109;JRO PROD + New servers upgrade;JBG PROD + new servers upgrade
SUP-33419;SUP-33268;0.8104;JTR PROD + new servers upgrade;JCZ PROD + new servers upgrade
SUP-33431;SUP-27097;0.8080;Vores Timeplan webversion og app virker ikke.;kan ikke logge på timeplan
SUP-33437;SUP-27919;0.8021;Kan ni uppdatera TEST TimePlan med verklig data från vår liveversion?;https://online.timeplan-software.net/bauhaussetest/
SUP-33156;SUP-32783;0.8379;SH tider i forkert afd. ;SH tider i forkert afd. 
SUP-31696;SUP-29000;0.7849;Ferie - Kontobevægelser fra ferieåret 22/23;det nye ferieår 2023/2024 kan ikke se på App
SUP-31257;SUP-32380;0.7871;Indstempling;Stempling via app
SUP-33399;SUP-28053;0.8060;Uppdatering av TEST till senaste versionen;Uppdatering av TEST miljön till den senaste versionen
SUP-27802;SUP-28139;0.8157;Mangler i forhold til kontrakt er ikke ens.;Mangler i forhold til kontrakt 
SUP-29836;SUP-30284;0.7937;WebSignIn;medarbejder kan ikke logge på APP
SUP-29558;SUP-29817;0.8057;Fejlbesked, når vi ophæver faktisk tid i tidsregistering;Kan ikke ophæve faktisk tid.
SUP-29556;SUP-28419;0.7979;mangler toolbar;JHR Toolbar missing
SUP-28848;SUP-28883;0.8379;TimePlan lukker ned, i Tidsregistering;Tidligere fejl opstår igen. 
SUP-33248;SUP-27064;0.7809;JBG PROD + new servers upgrade;JNL PROD upgrade
SUP-33354;SUP-29148;0.8314;JDK PROD + new servers upgrade;JDK PROD upgrade today
SUP-33369;SUP-26499;0.8190;Seniordage;Seniordag
SUP-33373;SUP-31920;0.7842;Penneo;Penneo
SUP-33367;SUP-31833;0.8258;Slet i planlægning;Kan ikke slette arbejdstid
SUP-32194;SUP-29388;0.8344;Lønoplysninger;Fejl i Timeplan App - Protræ
SUP-32947;SUP-31137;0.7956;Feriefri i minus;Fejl i reduktion i feriebeholdning
SUP-33339;SUP-26956;0.7932;Fejl ved login på webapp hos Dangleterre;Fejl meddelelse i APP
SUP-29426;SUP-28765;0.8022;Timeplan Error;Timeplan application error
SUP-29111;SUP-30295;0.7835;Error message + crash;System not working error message
SUP-30459;SUP-27445;0.7851;Kan ikke godkende timer;Kan ikke godkende manuel tid
SUP-29040;SUP-27177;0.8160;Timeplan kører langsomt;timeplan langsom
SUP-30887;SUP-32645;0.8213;Feriefri går i minus. ;FF på 4007
SUP-33322;SUP-31595;0.8364;SUP-31595;Helligdage er ikke længere rustrøde som de normalt er 
SUP-33313;SUP-30037;0.8031;Ferie regnskab;Feriefri
SUP-33306;SUP-31799;0.7893;SH - konto;Nedskrivning af SH-timer
SUP-32750;SUP-28652;0.7846;ferietimer;normtimer under ferie
SUP-33195;SUP-25848;0.8039;Registrering af tid;Kan ikke registrere sig fra mobil enhed
SUP-33219;SUP-28865;0.8275;Fejl ved lave nyt password;Error message when trying to send new password
SUP-33151;SUP-31679;0.7949;sms'er;SMS ikke modtaget
SUP-33235;SUP-33042;0.8056;Webapp - Mine data. Pårørende;Nærmeste pårørende forsvundet
SUP-33230;SUP-32682;0.8116;Penneo;Problem igen med att skicka avtal till Penneo
SUP-32451;SUP-31162;0.7820;Problemer med læsning af PDF filer (straffeattester);Filtyper under journal
SUP-33059;SUP-29715;0.8379;Licence limit;License limit exeeded
SUP-33164;SUP-29678;0.8188;Digital signatur - ref nr dannes ikke;ref nummer mangler digital signatur
SUP-32847;SUP-31129;0.8056;Overtid bliver ikke overført til afspadseringskonto;Mertimer afregnes ikke på afspadsering
SUP-33150;SUP-29400;0.8259;Bliver ikke tildelt reference ID;dokumenter til underskrift får ikke reference nr.
SUP-32998;SUP-29931;0.7833;tildeling af funktion på medarbejder;Tilknytning af funktioner
SUP-33112;SUP-28255;0.7874;Mulighed for at medarbejderne kan se vagtplan bagud i App;Tilbagekig medarbejdere
SUP-31881;SUP-31287;0.8009;Fejl i feriefri;Registrering af ferie vises ikke ens på Dagsspec. og under ferie - ej holdt ferie d. 7/12
SUP-31596;SUP-27662;0.8162;deriefri overførsel;Feriefri timer 2023/2024
SUP-31420;SUP-28671;0.8116;Timeplan virker ikke. Har i problemer?;Kan ikke komme på timeplan
SUP-31247;SUP-29379;0.8081;Kopier perioder;Kopier arbejdstid
SUP-30648;SUP-31093;0.7929;Holiday Balance;Holiday balance in wage run
SUP-33094;SUP-28879;0.8201;Opret linje;Kan ikke oprette linie
SUP-31204;SUP-29222;0.7929;JDK TOIL balance errors;JDK TOIL balance autorun 
SUP-33039;SUP-29826;0.8224;JCH: Password for WebApp is not working in test-system;JFI issue in resetting webapp password
SUP-33054;SUP-30850;0.8286;Kan inte logga in;Kan inte logga in
SUP-33077;SUP-32651;0.8349;Digital signatur opdatere ikke;Digital signatur opdatere ikke
SUP-32910;SUP-30284;0.7916;Problemer med at oprette medarbejdere i telefon App;medarbejder kan ikke logge på APP
SUP-33050;SUP-27086;0.8368;License limit exceeded;Log-in problemer
SUP-33066;SUP-32666;0.8002;fejl;Fejl i API
SUP-31374;SUP-29337;0.7923;Ferie - timeansatte;Lørdage tælles ikke med i ferieuge
SUP-32762;SUP-27374;0.8038;"Fraværstyperne ""Ønsket ferie"" og ""Ønsket feriefri"".";Ønsket ferie / Ønske ferie
SUP-33002;SUP-27097;0.7812;Får ikke logget inn i appen;kan ikke logge på timeplan
SUP-32880;SUP-25140;0.7991;Nulstil kode til Timeplan virker ikke;Nulstil password 
SUP-33018;SUP-29296;0.8087;JDK: error message in export with wages (autorun not running);JDK error when doing manual BI export
SUP-30827;SUP-30345;0.8136;Fejl i afspadsering;afspadseringskonto stemmer igen ikke
SUP-32974;SUP-31843;0.8337;Stamkort går i fejl ved overførsel til ProLøn;Stamkort går i fejl ved overførsel til ProLøn
SUP-32976;SUP-31794;0.7903;Haster haster;HASTER - Kan ikke tilgå Timeplan
SUP-32666;SUP-30876;0.8261;Fejl i API;Integration ti lrelesys
SUP-32504;SUP-32037;0.8236;SH tider ligger i forkert afd. ;SH tider i forkert afd. 
SUP-32307;SUP-31838;0.8303;Digital signing;Contracts Digital Signature
SUP-32347;SUP-29400;0.7873;Kontrakt sendes ikke til signering;dokumenter til underskrift får ikke reference nr.
SUP-32538;SUP-28117;0.7810;Løn lås;Kan ikke lønlåse
SUP-32900;SUP-31344;0.8394;Afspadsering;Afspadseringskonto
SUP-32855;SUP-28727;0.8254;Vi kan ikke ophæve faktisk tid;Kan ikke ophæve faktisk tid
SUP-32453;SUP-30481;0.7930;kan ikke udbetale/korrigerer feriefri;Kan ikke korrigere feriefri
SUP-32839;SUP-32797;0.8362;Timeplan online er nede;Timeplan online er nede, og har været det et stykke tid nu
SUP-30945;SUP-29930;0.8391;Dobbelt pause i visning på medarbejder app ved afholdelse af afspadsering;Pause
SUP-29930;SUP-23582;0.8134;Pause;Pause
SUP-31346;SUP-31348;0.8255;Afspadsering og pause;Afspadsering og pause - SUP-31346
SUP-29106;SUP-28981;0.7871;Forklaring på (60) på medarbejderens app.;Spørgsmål til pause Timeplan/app
SUP-28981;SUP-23582;0.8227;Spørgsmål til pause Timeplan/app;Pause
SUP-32820;SUP-31415;0.8137;Fejl ved godkendelse af ledig vagt;Fejl ved godkendelse af ledig vagt
SUP-31922;SUP-29379;0.7947;Indsætte kopierede arbejdstider fpr en periode;Kopier arbejdstid
SUP-27429;SUP-24241;0.8111;JFI issue with rehired employees holiday balance;JFI holiday issue
SUP-31441;SUP-24241;0.7991;JFI holiday counter issue;JFI holiday issue
SUP-31866;SUP-31283;0.7947;Starta om elektroniska dokument;Starta om elektroniska dokument
SUP-31692;SUP-31792;0.8324;Elktronisk reminder;Dokumenter kommer til underskrift, selvom der ikke er nogle.
SUP-31506;SUP-31218;0.8122;Ferie med løn i minus;Feriefri saldoer i minus
SUP-31415;SUP-29094;0.7826;Fejl ved godkendelse af ledig vagt;fejl ved godkendelse af vagt 
SUP-31400;SUP-28845;0.7915;Fejl i medarbejder afspadsering. ;Afspadserings saldo helt hen i skoven
SUP-31305;SUP-32625;0.8352;Ændringer af arbejdstid - Udrulning;Ændring af basisplan
SUP-31218;SUP-29571;0.8384;Feriefri saldoer i minus;Ferie - fejl negativ saldo 
SUP-32797;SUP-28671;0.8239;Timeplan online er nede, og har været det et stykke tid nu;Kan ikke komme på timeplan
SUP-32796;SUP-32361;0.7932;App;Problemer i app 
SUP-32799;SUP-29369;0.7948;Kommer inte åt webben;https://online.timeplan-software.com/gda/ 
SUP-32800;SUP-28012;0.8219;Can ́t reach - https://online.timeplan-software.com/beijer/;Can't reach the page
SUP-32783;SUP-31660;0.8121;SH tider i forkert afd. ;SH time på medarbejder i gl. afdeling
SUP-32022;SUP-27507;0.8158;Timeplan online er nede !;SYSTEM NEDE?
SUP-32746;SUP-26289;0.7974;Flextids oversigt pr. 31.12.23;Spørgsmål til udskrifter/export
SUP-31030;SUP-30528;0.8049;Kan ikke vælge mertid til afspadsering;Ikke muligt at vælge Mertid til afspadsering
SUP-32735;SUP-28033;0.8049;Manglende besked  ved ønsket fravær;Manglende besked
SUP-32573;SUP-32461;0.8346;Timeplan SignIn Site not available;Timeplan SignIn Terminals are not working
SUP-32262;SUP-31111;0.7958;JCH issue with webapp/websignin password;JCH webapp password issue
SUP-31701;SUP-31595;0.7967;Helligdage får ikke farve;Helligdage er ikke længere rustrøde som de normalt er 
SUP-32710;SUP-27309;0.7903;lønoplysninger;medarbejder kan ikke se lønfil/timeopgørelse for 1/15 marts
SUP-31203;SUP-31384;0.7847;Medarbejder kan ikke logge på - får fejlbillede;Kan ikke komme med medarbejderportalen
SUP-32708;SUP-31231;0.8121;ferietimer;Ferie regnskab.
SUP-31235;SUP-28388;0.8312;Trækker dobbelt på feriedage;dobbelt ferie på en dag
SUP-32694;SUP-32267;0.7933;Problemre med at udlåne timer til bestemt afdeling på en enkelt medarbejder;Timer der ikke kan udlånes
SUP-32052;SUP-28326;0.8046;Digital signatur;Digital signatur
SUP-32679;SUP-29400;0.8117;E-signature - får ikke kontrakter til underskrift;dokumenter til underskrift får ikke reference nr.
SUP-30950;SUP-26151;0.7895;Feriesaldo - Adina;Ferie 
SUP-32657;SUP-31958;0.8258;Ferie i minus;Muligt at bruge mere ferie end optjent
SUP-32645;SUP-31958;0.8045;FF på 4007;Muligt at bruge mere ferie end optjent
SUP-32651;SUP-32575;0.8365;Digital signatur opdatere ikke;Digital signatur kører ikke
SUP-32602;SUP-32606;0.8090;Saknas overenskomster i Vælg och sorter medarbejder?;Overenskomster forsvundet fra medarbejderfliter
SUP-32636;SUP-31576;0.8033;SH timer;SH timer på SC
SUP-30586;SUP-29090;0.8053;Feriesaldostyring;Systemet registrerer stadig dobbelt ferie
SUP-32632;SUP-27246;0.8343;Mangler referencenumre i TimePlan;ref nummer mangler digital signatur
SUP-32615;SUP-29090;0.7805;Trækker dobbelt ferie 10/3;Systemet registrerer stadig dobbelt ferie
SUP-32353;SUP-28805;0.7965;Slettet feriefri fjernes ikke fra medarbejderen og kan gå i negativ;Slet alt vist fravær
SUP-32623;SUP-32512;0.8220;SC med SH tider;SC med SH tider
SUP-32358;SUP-28750;0.8314;Problemer med at logge på timeplan via browser;Problemer med at tilgå Timeplan
SUP-32619;SUP-26678;0.7808;Overførsel af ferie;Overførsel af ferie/feriefri for restferie gl. ferieår til nyt ferieår - hvordan?
SUP-32575;SUP-32531;0.8267;Digital signatur kører ikke;Digital signatur opdatere ikke
SUP-32600;SUP-29651;0.7833;forældreorlov med løn lønkode 34;orlov med løn kommer ikke med over til løn
SUP-32492;SUP-32143;0.8177;JPL PROD upgrade;JNL PROD upgrade
SUP-32536;SUP-30146;0.7996;Ret i ansættelses start;Rettet medarbejder stopdato
SUP-31316;SUP-29139;0.8223;Kan ikke sende til digital signatur;Kan ikke sende til digital signatur
SUP-32534;SUP-27452;0.7968;Kan ikke oprette ferie på MA;Kan ikke oprette ferie på MA (317) afd.610
SUP-32531;SUP-27246;0.8258;Digital signatur opdatere ikke;ref nummer mangler digital signatur
SUP-32529;SUP-29501;0.8326;Ref nr dannes ikke;Digital signatur - ref nr dannes ikke
SUP-32516;SUP-32370;0.8262;senior timer ;Kan ikke bruge seniortimer
SUP-32513;SUP-28845;0.7946;afsp konto;Afspadserings saldo helt hen i skoven
SUP-32469;SUP-30649;0.8244;Access denied til Websignin;Access denied til Websignin
SUP-32496;SUP-26618;0.8301;Kan ikke logge på Timeplan;timeplans app
SUP-32486;SUP-28950;0.7934;Digital signatur kører ikke;Digital signatur opdatere ikke
SUP-31868;SUP-32309;0.8288;Digital signatur opdaterer ikke;Digital signatur opdatere ikke
SUP-31838;SUP-27941;0.8135;Contracts Digital Signature;Contracts BankID
SUP-31057;SUP-29783;0.8057;Ferie og feriefri;Nustilling af feriefri timer
SUP-30770;SUP-32076;0.8044;Restore employees data from 2 weeks ago;Rolling back planning and time data -End dates uploaded by mistake
SUP-30127;SUP-30324;0.7800;Timeplan app Lars;Melder fejl
SUP-28731;SUP-28765;0.7951;Application error ;Timeplan application error
SUP-28126;SUP-16934;0.8044;"Bliver ""smidt af""";TimePlan lukker ned ved indsættelse/sletning af fravær
SUP-28125;SUP-32063;0.8026;Dobbelt medarbejder;JHR delete double employee
SUP-31798;SUP-32309;0.8194;"Digital signatur - ""skal sættes i gang""";Digital signatur opdatere ikke
SUP-31685;SUP-27014;0.8168;FEJL: Timeplan svarer ikke på alle vores skærme;smidt af timeplan
SUP-31516;SUP-31326;0.7833;Vedr. Suzette Danielsen & Maiken afspadsering-saldo;Suzette Danielsen afspadseringssaldo
SUP-32461;SUP-29310;0.8280;Timeplan SignIn Terminals are not working;Kan inte logga in i Timeplan
SUP-32412;SUP-30458;0.8348;Casper Grønholdt - D870178 - Balance i Timebanken forkert igen ;Casper Grønholdt - D870178 - Balance forkert igen 
SUP-32426;SUP-29736;0.8305;Mangler afspadseringskonto;Manglende afspadseringskonto på en medarbejder
SUP-32433;SUP-27476;0.8000;Lønlås;Udfordringer med at Lønlåse-  Godkendelse af Fravær.
SUP-31833;SUP-28592;0.8188;Kan ikke slette arbejdstid;Kan ikke få lov til at slette en vagt
SUP-31678;SUP-30345;0.8102;Manglende afspadsering;afspadseringskonto stemmer igen ikke
SUP-31765;SUP-31907;0.8181;Employees are inactive;Employees are inactive
SUP-32032;SUP-25734;0.7884;Oprettelse af medarbejder;Ogiltigt personnummer
SUP-32385;SUP-30662;0.7828;Slette en historikpost;Slette en linje i historikken
SUP-32387;SUP-27120;0.8298;Ferie går i negativ;"Negativ ferie flyttes fra ""med løn"" til ""uden løn"""
SUP-32309;SUP-31639;0.8356;Digital signatur opdatere ikke;Digital signatur opdatere ikke
SUP-32319;SUP-28621;0.7827;JAT incorrect TOIL start balance;JAT TOIL correction
SUP-32361;SUP-28191;0.8106;Problemer i app ;kan ej se schema i webapp
SUP-32331;SUP-25889;0.8317;Sletning af fratrådte medarbejdere samt medarbejder planlægningsdata;Ssletning af fratrådte medarbejdere
SUP-27309;SUP-29388;0.8311;medarbejder kan ikke se lønfil/timeopgørelse for 1/15 marts;Fejl i Timeplan App - Protræ
SUP-31325;SUP-28049;0.8010;Hvordan beregnes varslingsreglen for 120 dages reglen;120 dages regel
SUP-30130;SUP-30964;0.7842;Fejl i feriefritimer;Feriefritimer bliver registreret i forkert ferieår
SUP-29495;SUP-30471;0.7837;visning af medarbejder i sekundær afdeling (basisplan);Kan medarbejdere vises i både primær og sekundær afdeling, i afdelingsplan?
SUP-32332;SUP-29810;0.8023;Flex-timer Anne Mette;Flextimer Annemarie
SUP-28759;SUP-30409;0.7865;Fejl ved oversigt - ændrede medarbejde (systemet lukker ned);Fejl ved oversigt - ændrede medarbejde (systemet lukker ned)
SUP-32243;SUP-29198;0.8250;Protræ - Timeplan app;Timeplan nede
SUP-30837;SUP-30408;0.8212;Kan ikke tilgå appen;app problemer ?
SUP-30740;SUP-29037;0.8381;Fejl i flexsaldo;Fejl på flex saldo
SUP-30554;SUP-29171;0.8107;dobbelt ferie på en dag;Feriedage dobbelt
SUP-30373;SUP-29239;0.7949;Kan ikke registrere ferie på medarbejder;Må ikke registerer feriedag
SUP-30262;SUP-30510;0.8035;Fejl i tildeling af ferie;Tilskrivning af feriedage
SUP-30184;SUP-30321;0.8132;Timeplan app;TimePlan virker fortsat ikke
SUP-30056;SUP-31862;0.7827;Sygefravær?;kan ikke godkende en vagt
SUP-29621;SUP-29061;0.7875;Stemplede timer kommer ikke over i tidsregistrering;Ind-/udstemplinger vises ikke i Tidsregistrering 
SUP-29171;SUP-31200;0.8173;Feriedage dobbelt;Ferietimer bliver registreret dobbelt
SUP-28917;SUP-29376;0.8161;Enda en gang problemer med verktøylinjen;Mangler en række ting - se billeder
SUP-28696;SUP-30046;0.8270;kan ikke logge på Timeplan;Timeplan utilgængelig
SUP-28360;SUP-27120;0.7861;Ferie;"Negativ ferie flyttes fra ""med løn"" til ""uden løn"""
SUP-28191;SUP-32035;0.7907;kan ej se schema i webapp;arbejdsplan
SUP-28069;SUP-29796;0.8092;Overført ferie;Feriefri problem
SUP-29105;SUP-27312;0.8236;Feriefri i negativ;feriefri på medarbejder
SUP-31046;SUP-17671;0.8038;Udskriftfejl;Vi kan ikke printe fra Timeplan
SUP-32267;SUP-25471;0.7933;Timer der ikke kan udlånes;Bruger kan ikke udlåne
SUP-32287;SUP-28007;0.8035;Kan ikke udbetale ferie for ferieåret 22/23;Udbetal ferie i en kørsel
SUP-32268;SUP-31434;0.7911;Slette en historikpost;Opdatering i går
SUP-31910;SUP-31539;0.7858;JNL/JBE TEST issues with TOIL;JNL TEST error
SUP-31895;SUP-31605;0.7828;Feriefri;Ferie vises i timer efter opdatering - ikke længere i dage
SUP-32234;SUP-32035;0.7964;appen;arbejdsplan
SUP-31065;SUP-31044;0.8201;TimePlan er nede - Webappen;TimePlan er nede - Webappen
SUP-32143;SUP-30393;0.7958;JNL PROD upgrade;JDK PROD upgrade
SUP-32223;SUP-30799;0.8040;Slettet vagter;Historik og slettede aktiviteter 
SUP-31831;SUP-29822;0.8365;Udlån af medarbejdere i basisplan;Basisplan
SUP-31498;SUP-26678;0.8249;Harald Nyborg;Overførsel af ferie/feriefri for restferie gl. ferieår til nyt ferieår - hvordan?
SUP-31294;SUP-28681;0.7926;Kan ikke logge ind;Kan ikke logge på. 
SUP-30959;SUP-29173;0.7849;Registrering af ferie, dage vs. timer;Registrering af ferie i TP
SUP-30858;SUP-29768;0.7894;Hvorfor vises ferie uden løn hos en ophørt medarbejder, når medarbejder har ferie med løn?;Forsøgt at nulstille ferie uden løn
SUP-30536;SUP-31632;0.8000;Mariehjem kan ikke logge på;Kan ikke logge på timeplan
SUP-32200;SUP-29946;0.8089;Kan ikke godkende dag eller tidsregistreringer;Kan ikke registrerer arb. tid i dag
SUP-32063;SUP-29460;0.7963;JHR delete double employee;Issue with employee - Urgent
SUP-32078;SUP-31926;0.7847;Hjælp til script;Script i lønfil 
SUP-30916;SUP-31320;0.8161;Igen timer forsvundet fra afspadserings konto;igen forsvundne timer fra afsp. konto
SUP-32151;SUP-31410;0.8301;Service Unavailable;Timeplan virker ikke
SUP-30999;SUP-27456;0.8315;Kan ikke godkende dagen;Kan ikke godkende dagen
SUP-30400;SUP-30819;0.8094;godkendte ledige vagter ligger stadig til godkendelse på app;vagter er godkendt, men medarbejde kan ikke se den er godkendt
SUP-30658;SUP-30590;0.7885;timer ikke med over i lønfil;Manglende timer på rapporten til løn
SUP-32140;SUP-27497;0.8173;Kan ikke tildele personalekort nr. ;Kan ikke oprette scannekort på stamkort
SUP-32146;SUP-29425;0.7881;Skal ikke have stop dato på;Slettelse af fratrædelsesdato og ny ansættelse
SUP-32107;SUP-28769;0.8187;JDK Export error;Timeplan application Error executin export
SUP-29865;SUP-32067;0.7847;Tilføje timer på konti;Konti - afspadsering - kan ikke tilføje manuelt
SUP-32127;SUP-31576;0.7818;SH timer på ledende medarbejder;SH timer på SC
SUP-32124;SUP-29310;0.8058;Knowles - Timeplan - login;Kan inte logga in i Timeplan
SUP-32097;SUP-31576;0.7960;SH timer på ledende medarbejder;SH timer på SC
SUP-32120;SUP-26976;0.8054;JNL TEST upgrade;JNL TEST system upgrade
SUP-31836;SUP-29711;0.8213;License limit exceeded (Users);Bruger kan ikke logge ind
